<?xml version="1.0" encoding="UTF-8"?>
<!DOCTYPE variations SYSTEM "variationDocType.dtd" >
<variations>
  <profile type="standard" rate="30">
    <duration>150</duration>
  </profile>
  <transition type="exponential">
  	<duration>250</duration>
  </transition>
  <profile type="standard" rate="350">
    <duration>400</duration>
  </profile>
  <transition type="exponential">
  	<duration>50</duration>
  </transition>
  <profile type="standard" rate="30">
    <duration>350</duration>
  </profile>
</variations>
